{
  "schema_version": "3.0",
  "event_id": "0198f000-0000-7000-8000-000000000005",
  "task_id": "0198f000-0000-7000-8000-000000000001",
  "task_revision": 1,
  "episode_id": "0198f000-0000-7000-8000-000000000006",
  "source_sequence": 48,
  "occurred_at": "2026-08-02T00:02:03Z",
  "payload": {
    "type": "object_episode",
    "target_id": "primary_target",
    "condition": "appeared",
    "duration_ms": 3000,
    "count": 1
  }
}
